ID,"Label","FS name",FS macro region,"Description"
1141,"Adopt salinity tolerant varieties","Rice",SA,"The development and adoption of salinity tolerant rice varieties will contribute to farmers' climate resilience."
1142,"Plant multiple varieties","Rice",SA,"In the rice-based agricultural system the mixing of seed of early rice and late maturing deep water rice is practiced to avoid crop failure in the case of flooding. The seeds are mixed in 3:1 ratio in Tamil Nadu and Kerala. In the rice agricultural system in Sri Lanka, farmers typically cultivate more than two varieties of rice."
1143,"Adopt submergence tolerant varieties","Rice",SA,"The development and adoption of submergence tolerant rice varieties (e.g. gene sub1 isolated from the FR13A variety) will contribute to farmers' climate resilience."
1144,"Plant multiple crop types","Rice",SA,"Alternative crops can be planted on the same land each year following the main rice crop. This can be done with shorter season rice varieties. The alternative crop types can be used to enhance the productivity of a system by improving soil fertility, reducing pests and diseases and improving water use efficiency. For example, planting green manure crops such as grain legumes/pulses in rice-based systems improves soil fertility and crop productivity."
1145,"Implement conservation agriculture practices","Rice",SA,"Conservation agriculture practices are recommended to improve the sustainability of the rice agricultural system, key practices to implement include: crop rotation, reduced/no tillage and mulching and crop residue retention. Multi-locational trials in India found that rice-based cropping systems performed better under green manure and farmyard manure applied plots than those without organic manure. Conservation agriculture is mainly adopted on large mechanised farms in India, with adoption rates much lower on smallholder farms."
1146,"Implement climate smart agriculture practices","Rice",SA,"Climate-smart agriculture practices such as the use of high-yielding and stress-tolerant varieties, adoption of improved water management technologies, alternate wetting and drying, direct seeded rice and carbon management through residue retention/incorporation can be used to increase crop productivity when faced with a changing climate."
1147,"Diversify livelihoods","Rice",SA,"Livelihood diversification such as incorporating dairy, aquaculture, horticulture and local value-added processing as well as increased off-farm income are important household strategies to escape poverty. There is potential to replace water-intensive Boro rice with more profitable vegetables such as cucumber or high-yielding potato varieties. "
1148,"Adopt an integrated farming system approach","Rice",SA,"An integrated farming system approach aims at increasing smallholder farmers' profitability and sustainability. With the decline in farm size due to demographic pressure, it is necessary to integrate other land-based enterprises such as dairy, fish, poultry, apiary, vegetables and fruit. Deep-water rice systems offer a suitable environment for the production of fish and other aquatic organisms. Integrated rice–duck farming systems in rice paddies provide food (weeds and pests) for ducks, and the ducks fertilise the soils. "
1149,"Adopt disease tolerant varieties","Rice",SA,"A suggested adaptation option to an increase in crop diseases includes breeding and planting of disease tolerant varieties."
1150,"Implement efficient water management","Rice",SA,
1151,"Invest in agricultural research and development","Rice",SA,"Targeted research is needed to develop site-specific nutrient management systems in the rice-based cropping system, including more efficient use of soil ameliorants, green and animal manures, and crop residues. Effective research and extension programmes are needed to improve farmers' production practices. Researchers should work with farmers to understand their needs and reasons for non-adoption of new technologies and practices and to co-develop solutions. "
1152,"Establish farmer organisations","Rice",SA,"Local farmer cooperatives provide an institutional mechanism for implementing and scaling up climate-smart agricultural practices and increasing rice yields. "
1153,"Improve networking and knowledge exchange","Rice",SA,"Improve agricultural research and development by encouraging networking and knowledge sharing between research individuals and institutions and establishing effective collaborative relationships. "
1154,"Establish water user associations","Rice",SA,"The establishment of water user associations can be an effective means for improving water use efficiency."
1155,"Policy reform","Rice",SA,"Achieving more productive and sustainable rice-based cropping systems requires policy coherence across agricultural industry and trade, land and water resources management, agricultural extension systems, and marketing systems for rice and related products."
1156,"Improve access to credit","Rice",SA,"Improving smallholder rice farmers' access to credit facilities will allow them to adopt improved practices and technology, thereby enhancing their resilience to climate change."
1157,"Improve access to risk insurance schemes","Rice",SA,"Improved access to insurance for rice farmers will allow them to invest in new climate-smart practices and technologies, thereby improving their yields and income opportunities."
1158,"Farmers engaged in agri system","Rice",SA,"Millions of farmers are engaged in rice cultivation in South Asia, many of which are smallholders with limited capacity for climate change adaptation. For example, in India, more than 80% of rice farmers belong to small and marginal groups."
1159,"Food insecurity","Rice",SA,"Rice is a food staple in South Asia. Climate change is expected to result in fluctuations in rice production and market prices thereby aggravating food insecurity."
1160,"Loss of livelihoods ","Rice",SA,"Climate change is reducing rice yields and affecting the livelihoods of millions of farmers in South Asia, particularly smallholders with limited capacity for climate change adaptation. For example, in Bangladesh, more than 25% (1.8 million) of the total labour force is engaged in agricultural activities, with rice being the most important cereal crop accounting for about 16% of the total land area and contributing 7% to agricultural GDP."
1161,"Increasingly erratic rainfall","Agro-Pastoral Millet/Sorghum",SSA,"Erractic rainfall characterised by unpredictable onset and ceasation of rainfall,  ‘false starts’ and shorter duration of rainy seasons with intervals of extreme rain or absence of it resulting in flooding or droughts. Rainfall seasonality is relatively reliable in the system. However the volume and distribution of rainfall in time during the rainy season(s) and space is highly unpredictable, with significant risks of crop failure. "
1162,"Increase in drought events","Agro-Pastoral Millet/Sorghum",SSA,"Extreme drought occurences are increasing and are worsening food insecurity in the regions"
1163,"Decrease in average precipitation","Agro-Pastoral Millet/Sorghum",SSA,"Reduced or variable rainfall and increased heavy rainfall events. In Senegal Rainfall decreases range from -150 to -50 mm across much of the country; Summer rains have remained steady in Senegal over the past 20 years but are 15% below the 1920– 1969 average."
1164,"Increase in average temperatures","Agro-Pastoral Millet/Sorghum",SSA,"Since 1960, the average temperature has increased by 0.9°C. By 2060, average annual temperatures are projected to rise by 1.1– 3.1°C."
1165,"Increase in extreme heat (no. of hot days)","Agro-Pastoral Millet/Sorghum",SSA,"Increase of 27 hot days per year since 1960 in Senegal. By 2060, substantial increases in the frequency of hot days and nights are projected, with more rapid increases in the south and east of Senegal"
1166,"Increase in average precipitation","Agro-Pastoral Millet/Sorghum",SSA,
1167,"Increase in extreme rainfall events","Agro-Pastoral Millet/Sorghum",SSA,"Excessive rainfall occurs causing flooding in lowland areas"
1168,"Increased flooding","Agro-Pastoral Millet/Sorghum",SSA,"Flooding in lowland areas due to excessive rainfall. When flooding occurs, sorghum plots on heavier lowland soils with high moisture retention perform poorly, while millet will tend to produce well under these conditions on the lighter soils of slopes and plateaus"
1169,"Increase in diseases","Agro-Pastoral Millet/Sorghum",SSA,"Increase in vector-borne diseases such as Rift Valley Fever and malaria as a result of increased precipitation  and temperature in the south of Sahel."
1170,"Reduced crop productivity/failure","Agro-Pastoral Millet/Sorghum",SSA,"Climate change will have an impact on crop yields. Yields of maize, millet and sorghum are projected to decline, while yields of cassava, cow peas, groundnutsand rice are projected to benefit from CO2 fertilisation. Farmers will need to adapt to these changing conditions"
1171,"Reduced herd size","Agro-Pastoral Millet/Sorghum",SSA,"During drought, culling of weak livestock for food and cash needs"
1172,"Reduced fodder availability","Agro-Pastoral Millet/Sorghum",SSA,"Drought causing reduced fodder and  water availability"
1173,"Reduced forage quality","Agro-Pastoral Millet/Sorghum",SSA,"Projections into the future generally indicate widespread negative impacts on forage quality"
1174,"Change in production zone suitability","Agro-Pastoral Millet/Sorghum",SSA,"As a result of climate change agropastoral-pastoral margin will retreat across Africa resulting in less area climatically suited for productive agropastoral practices."
1175,"Water scarcity","Agro-Pastoral Millet/Sorghum",SSA,"Increased temperatures causing reduce water and pasture avilability  hence causing reduction in livestock health and competition for resources and conflicts"
1176,"Increased incidence of bushfires","Agro-Pastoral Millet/Sorghum",SSA," Bush fire incidences occurs in pastoral systems often during. Extreme drought events are likely to worsen such practices"
1177,"Increase in pests ","Agro-Pastoral Millet/Sorghum",SSA,"Amplified effects of parasites due to lowered immunity associated with poor nutrition."
1178,"Crop stress/damage/mortality","Agro-Pastoral Millet/Sorghum",SSA,
1179,"Unpredictable planting period","Agro-Pastoral Millet/Sorghum",SSA,
1180,"Reduced livestock productivity","Agro-Pastoral Millet/Sorghum",SSA,
1181,"Reduced fodder quality","Agro-Pastoral Millet/Sorghum",SSA,
1182,"Increase in heat stress","Agro-Pastoral Millet/Sorghum",SSA,
1183,"Land degradation","Agro-Pastoral Millet/Sorghum",SSA,
1184,"Decrease in diseases","Agro-Pastoral Millet/Sorghum",SSA,"Decrease in vectoral diseases e.g. tsetse fly. "
1185,"Increase in livestock mobility","Agro-Pastoral Millet/Sorghum",SSA,"Increase in livestock mobility in search for water and forage."
1186,"Competition for resources","Agro-Pastoral Millet/Sorghum",SSA,"Competition with non-nomadic farmers for access to water."
1187,"Increase in migration","Agro-Pastoral Millet/Sorghum",SSA,
1188,"Conflict over resources","Agro-Pastoral Millet/Sorghum",SSA,
1189,"Decrease in livestock mobility","Agro-Pastoral Millet/Sorghum",SSA,
1190,"Dependence on food aid","Agro-Pastoral Millet/Sorghum",SSA,
1191,"Loss of income","Agro-Pastoral Millet/Sorghum",SSA,
1192,"Increase in food insecurity","Agro-Pastoral Millet/Sorghum",SSA,
1193,"Increase in poverty","Agro-Pastoral Millet/Sorghum",SSA,"Close to 100 million farmers, half of them extremely poor, live in the African agropastoral farming system characterized by highly variable, semi-arid climate and poor soil conditions"
1194,"Unsustainable natural resource use","Agro-Pastoral Millet/Sorghum",SSA,"Unsustainable land and water management practices in the system  which contributes to land degradation,reduced productivity"
1195,"Demographic pressure on land","Agro-Pastoral Millet/Sorghum",SSA,"Key trends in the system include rapid population growth and urbanization"
1196,"Reliance on rainfed agriculture","Agro-Pastoral Millet/Sorghum",SSA,
1197,"High illiteracy rates ","Agro-Pastoral Millet/Sorghum",SSA,
1198,"Unequal opportunities for women ","Agro-Pastoral Millet/Sorghum",SSA,"A major gender gap in the agropastoral system concerns customary access to land, the most basic production factor."
1199,"Weak land tenure and access rights for women","Agro-Pastoral Millet/Sorghum",SSA,
1200,"Weak land tenure ","Agro-Pastoral Millet/Sorghum",SSA,
1201,"Inadequate climate information services","Agro-Pastoral Millet/Sorghum",SSA,"Information on weather predictions and early warning mechanisms is often inadequate  and untimely"
1202,"Low access to markets","Agro-Pastoral Millet/Sorghum",SSA,"Both domestic and international market systems are underdeveloped in most systems. In East Africa pastoralists travel Long distance from the urban centres"
1203,"Barriers to trade","Agro-Pastoral Millet/Sorghum",SSA,
1204,"Lack of access to market information","Agro-Pastoral Millet/Sorghum",SSA,"To reduce financial risks and purchase of inputs such as fertiliser, slash and burn is used to control weeds and a limited form of shifting cultivation are only practised in low population areas, for example Mozambique and Zambia, and also in southern Ethiopia, as justified by bush encroachment in bimodal and subtropical bioclimates"
1205,"Low access to credit","Agro-Pastoral Millet/Sorghum",SSA,
1206,"Unstable commodity prices","Agro-Pastoral Millet/Sorghum",SSA,
1207,"Water scarce area","Agro-Pastoral Millet/Sorghum",SSA,"Reduced water availability since 1960, especially around the Senegal River Basin."
1208,"High prevalence of land degradation","Agro-Pastoral Millet/Sorghum",SSA,"Land degradation affects 34% of the territory. Soil degradation is prominent, it is primarily caused by overgrazing and forest clearing."
1209,"Unfavourable soil conditions","Agro-Pastoral Millet/Sorghum",SSA,"The system is characterized by highly variable, semi-arid climate and poor soil conditions."
1210,"Land fragmentation","Agro-Pastoral Millet/Sorghum",SSA,"The increasing subdivision and privatization of land in East Africa particularly Kenya complicates livelihoods as it may lead to fencing, which reduces livestock access to pasture, watering points and saltlicks, and curtails mobility during drought.  In west Africa, there is increasing restriction to mobility due to expansion of crop field into grazing land. Some pastoralists go on long distance transhumance to sub-humid zone "
1211,"Small farm size","Agro-Pastoral Millet/Sorghum",SSA,"Farm sizes are usually small and diversity is the norm in West African farming systems. Even at the level of the individual farm unit, farmers typically cultivate 10 or more crops in diverse mixtures that vary across soil type, topographical position and distance from the household compound."
1212,"Limited uptake of modern technologies","Agro-Pastoral Millet/Sorghum",SSA,"Low adoption of new technology is mostly related to their low profitability and perceived risks rather than available capital"
1213,"High poverty levels ","Agro-Pastoral Millet/Sorghum",SSA,"Close to 100 million farmers, half of them extremely poor, live in the African agropastoral farming syste.  Senegal for example is has 47% of the population living under the national poverty line."
1214,"Unequal opportunities for women ","Agro-Pastoral Millet/Sorghum",SSA,"Gender inequality  is high in the system due to traditional social and religious norms."
1215,"Limited uptake of modern technologies","Agro-Pastoral Millet/Sorghum",SSA,"Smallholder farmers lack the capacity to process, store or distribute agricultural products."
1216,"Lack of knowledge on processing/value addition","Agro-Pastoral Millet/Sorghum",SSA,"Smallholder farmers lack the capacity to process, store or distribute agricultural products.Technology will play a significant role in adapting pastoral and agro-pastoral systems to climate change"
1217,"Predominantly small-scale subsistence farming","Agro-Pastoral Millet/Sorghum",SSA,"More than 90% of Senegal's agricultural land is comprised of small-scale, family-based farms engaged in subsistence and rain-fed agriculture."
1218,"Conflict prone area","Agro-Pastoral Millet/Sorghum",SSA,"Tradition of violent theft of cattle (cattle rustling) and problem of armed rebellion in the Horn of Africa. Ther is also conflict occassionally along transhumance routes West Africa. In some other parts agro-pastoralist land is being lost to agricultural investors and this is likely to hinder mobility. This is likely to affect traditional migratory routes  for different seasons"
1219,"Unequal opportunities for women ","Agro-Pastoral Millet/Sorghum",SSA,"One of the challenges for the system is land resource access and tenure constraints especially for women.  Customary tenure systems continue to predominate in the system, especially in rural areas, in spite of statutoryefforts to ‘modernize’ the tenure landscape in recent decades."
1220,"Lack of willingness to invest in sustainable agricultural practices","Agro-Pastoral Millet/Sorghum",SSA,
1221,"Reliance on rainfed agriculture","Agro-Pastoral Millet/Sorghum",SSA,
1222,"Large contributor to national GDP","Agro-Pastoral Millet/Sorghum",SSA,
1223,"Reliance on rainfed agriculture","Agro-Pastoral Millet/Sorghum",SSA,
1224,"Dependent on a single crop type","Agro-Pastoral Millet/Sorghum",SSA,
1225,"Demographic pressure on land","Agro-Pastoral Millet/Sorghum",SSA,"Demographic pressure on land is transforming transhumance and communal grazing to more sedentary forms of production."
1226,"Implement reforestation practices","Agro-Pastoral Millet/Sorghum",SSA," Scale-up agroforestry interventions e.g. farmer-managed natural regeneration (FMNR)."
1227,"Invest in water harvesting and storage infrastructure","Agro-Pastoral Millet/Sorghum",SSA,"Construction of small dams in Senegal to collect water for farming and animal use "
1228,"Diversify livelihoods","Agro-Pastoral Millet/Sorghum",SSA,"Farmers adapt to uncertain climatic and environmental conditions through a range of adaptive management practices such as adoption of short cycle cultivars, the relocation of some crops and the practice of market gardening in rainy conditions alternating according to the seasons and women breeding small ruminants for sale."
1229,"Promote literacy ","Agro-Pastoral Millet/Sorghum",SSA,"An increase in education amongst pastoralist communities, resulting in increasing opportunities for new employment and diversification, and participation in national political processes "
1230,"Build women's  capacity ","Agro-Pastoral Millet/Sorghum",SSA,"Increase women access to land resources and paid labour to enhance their benefits and enable them to access opportunities for value addition and improved production"
1231,"Implement fodder management","Agro-Pastoral Millet/Sorghum",SSA,"Promote market-driven models to establish fodder production via such as purely rain-fed fodder production,rain-fed fodder with supplemental irrigation from harvested rainwater (e.g., sub-surface dams) andf odder production based on the groundwater irrigation for sites with groundwater table close to the surface."
1232,"Implement efficient water management","Agro-Pastoral Millet/Sorghum",SSA,"In southern Africa some of the strategies include reducing the plant population to reduce the water demand by crops."
1233,"Diversify livestock ","Agro-Pastoral Millet/Sorghum",SSA,"Shift to small ruminants and camels. "
1234,"Implement fodder management","Agro-Pastoral Millet/Sorghum",SSA,
1235,"Adopt drought tolerant varieties","Agro-Pastoral Millet/Sorghum",SSA,"Adaptation strategies such as switching to improved varieties in climate change-sensitive crops need to be considered, yet should be carefully weighed against adverse outcomes, such as a resulting decline of agro-biodiversity and loss of local crop types"
1236,"Plant multiple varieties","Agro-Pastoral Millet/Sorghum",SSA,"Cultivar devopment targeting varieties that response to more than one threats "
1237,"Implement efficient water management","Agro-Pastoral Millet/Sorghum",SSA,"Implement water conservation technologies alongside cultivar development e.g irrigation and water harvesting, sub, surface dams along river beds"
1238,"Implement agroforestry practices","Agro-Pastoral Millet/Sorghum",SSA,"Integrating trees with crops serve as “nutrient pumps,” bringing nutrients that are too deep for crops. They can be used to enhance soil nitrogen, when nitrogen-fixing trees are planted. Their leaves can serve as mulch which might suppress some weed growth but would also help cool the soil."
1239,"Improve climate change awareness","Agro-Pastoral Millet/Sorghum",SSA,"With climate information services, farmers will be able to plan their planting and make projections about rainfall distribution patterns and temperature variations"
1240,"Implement conservation agriculture practices","Agro-Pastoral Millet/Sorghum",SSA,"Soil organic matter is beneficial to cultivation, due to its abilities to improve soil structure and enhance water and nutrient retention. It includes practices such as no-till agriculture, offseason cover crops, use of animal manure and biochar."
1241,"Adjust crop calendar","Agro-Pastoral Millet/Sorghum",SSA,
1242,"Livestock mobility to semi-arid/sub-humid zones","Agro-Pastoral Millet/Sorghum",SSA,
1243,"Plant multiple crop types","Agro-Pastoral Millet/Sorghum",SSA,
1244,"Plant multiple crop types","Agro-Pastoral Millet/Sorghum",SSA,
1245,"Capacity building on sustainable agricultural practices","Agro-Pastoral Millet/Sorghum",SSA,
1246,"Build capacity on value addition","Agro-Pastoral Millet/Sorghum",SSA,
1247,"Undertake crop rotation","Agro-Pastoral Millet/Sorghum",SSA,"Limited form of shifting cultivation are only practised in low population areas, for example Mozambique and Zambia, and also in southern Ethiopia, as justified by bush encroachment in bimodal and subtropical bioclimates"
1248,"Establish farmer organisations","Agro-Pastoral Millet/Sorghum",SSA,"A significant potential for poverty reduction is expected through the intensification and diversification of the agropastoral system, especially among farmers who are able to organize themselves in farmer associations."
1249,"Increase awareness of gender equality ","Agro-Pastoral Millet/Sorghum",SSA,
1250,"Build the capacity of agricultural extension agents","Agro-Pastoral Millet/Sorghum",SSA,"Build capacity and support technical and extension services and research."
1251,"Invest in agricultural research and development","Agro-Pastoral Millet/Sorghum",SSA,
1252,"Invest in agricultural research and development","Agro-Pastoral Millet/Sorghum",SSA,"Incorporating in R&D approaches to build a whole system capacity and adopting an integrated approach that addresses the range of constraints farmers face along the value chain."
1253,"Land tenure reform","Agro-Pastoral Millet/Sorghum",SSA,"Improve land tenure and access rights in the agropastoral system."
1254,"Improve access to climate information services","Agro-Pastoral Millet/Sorghum",SSA,"Increased access to agricultural support services, which improves the availability and the quality of relevant climate information will further enhance awareness of climate change within of the rural community and result in better management of climate-induced risks in these vulnerable agricultural systems.asts and early warning systems."
1255,"Improve access to agricultural extension services","Agro-Pastoral Millet/Sorghum",SSA,
1256,"Policy reform","Agro-Pastoral Millet/Sorghum",SSA,
1257,"Develop/improve early warning systems","Agro-Pastoral Millet/Sorghum",SSA,"Use of intricate systems of local knowledge to predict weather or forecast a climatic event. This allows pastoralists to better plan for and manage drought (for example, agro-pastoralists in Kenya use indigenous indicators of rainfall variability to interpret meteorological forecasts)"
1258,"Build climate information services","Agro-Pastoral Millet/Sorghum",SSA,
1259,"Improve access to markets","Agro-Pastoral Millet/Sorghum",SSA,"Improved access to markets for tree products, cereals and animal feeds has increased commercialisation of the products and competition for resources.I Market access also enhance diversified production and community resilience."
1260,"Improve access to credit","Agro-Pastoral Millet/Sorghum",SSA,"The conversion of livestock resources into financial resources through uptake of saving schemes which can smooth livelihood volatility. Credit schemes may help with investment that can increase productivity or livelihood diversification"
1261,"Facilitate access to loans","Agro-Pastoral Millet/Sorghum",SSA,"Sharing, loaning and gifting of livestock is part of pastoralists’ traditional social networks, but intensifies during and after drought. Also sharing of labour between families to act as a social safety-net"
1262,"Improve access to market information","Agro-Pastoral Millet/Sorghum",SSA,"Develop market information systems."
1263,"Improve access to risk insurance schemes","Agro-Pastoral Millet/Sorghum",SSA,
1264,"Farmers engaged in agri system","Agro-Pastoral Millet/Sorghum",SSA,"More than 90% of Senegal's agricultural land is comprised of small-scale, family-based farms engaged in subsistence and rain-fed agriculture. The livestock sub-sector employs about 3 million people."
1265,"Area of land used","Agro-Pastoral Millet/Sorghum",SSA,"Permanent meadows and pastures for livestock rearing constitute 29% of Senegal's total harvested land area."
1266,"Risk to farmers of loss of livelihoods due to Climate Change","Agro-Pastoral Millet/Sorghum",SSA,"Climate change affecting the ability to sustain agro-pastoralist livelihoods in East africa region"
