ID,"Label","FS name",FS macro region,"Type-1","Description"
1,"Increase in average temperatures","Lowland Rice",EAP,"Hazard","Increase in Temperature of 0.02-0.03 °C per year by 2050 across the entire region is expected"
2,"Rising sea levels","Lowland Rice",EAP,"Hazard","The tides are rising at a rate close to ~2 cm/year, and salinity has increased by approximately 0.2–0.5 PSU/year.  Sea levels are expected to rise in the region by 45-75 cm by 2090.  Average sea level rise of 3 mm per year over the last 30 years . This is a major threat to a part of the world which, on average, is less than 2 metres above sea level."
3,"Increase in drought events","Lowland Rice",EAP,"Hazard","The risk of drought often occurs during the Winter-Spring rice crops, particularly in El Niño years. Severe drought years such as 1977–1978, 1997–1998, 2015–2016 and 2019–2020 are all related to El Niño events, which greatly affect production and life in the Mekong Delta. During low river flow periods, between March and April, saline water intrudes up to 40–50 km inland from estuaries through main river systems  and about 100,000 ha of rice annually is at high risk of dry-season salinity intrusion."
4,"Increase in average precipitation","Lowland Rice",EAP,"Hazard","In recent years, farmers in many provinces have had to readjust the crop calendar, to rotate rice with short-term crops, or to convert their rice land to aquaculture. It is worth noting that the rate of increase in aquaculture area in the Mekong Delta experienced an important surge after El Ninõ 2015–2016 (mean annual increase of 18.3 T ha in 2016–2019, as compared to 4.25 T ha in 2008–2015). Rainfall has increased at the end of the rainy season but decreased at the beginning of the rainy season over the last 10 years. Shifting rainfall patterns such as these can have an adverse effect on the agricultural productivity of the Mekong Delta. A 30% annual increase in precipitation has been observed."
5,"Decrease in average precipitation","Lowland Rice",EAP,"Hazard","The temperature has increased, annual rainfall has decreased and is distributed less evenly, and the dry season lasts longer. Results indicate a significant downward trend in rainfall in the Kien Giang, Soc Trang, and Ca Mau provinces, where the rice-growing areas are mainly based on rainfall. Therefore, these areas have a potential risk of water shortages, resulting in increased production costs especially during the winter-spring crop season, and a rice productivity decline, which would indirectly contribute to threatening the food security of the region and Vietnam as a whole."
6,"Saline intrusion","Lowland Rice",EAP,"Impact","The risks of increasing saline intrusion and permanent inundation due to sea level rise, will significantly reduce the land suitable for rice cultivation in the Mekong delta by 50 % by 2050. Coastal provinces are strongly affected by saline intrusion from the second half of December to the end of April. Recently, saline intrusions tend to occur earlier, with increased salinity concentrations and duration, and are more invasive in the fields. Salinity intrusion is associated with low water discharge from upstream of the Mekong River. This is caused by the below average rainfall in the Mekong basin due to the El Niño. With insufficient upstream water flow to push back seawater, salinity intrusion increased in concentration and duration. It was also aggravated by the drought and high temperature in the region. Salinity intrusion is also caused by the construction of dams further upstream on the Mekong River and dams on the lower Mekong River, which reduce water flow and prevent the renewal of the delta silt deposits."
7,"Shorter growing seasons","Lowland Rice",EAP,"Impact","In recent years, farmers in many provinces have had to readjust the crop calendar, to rotate rice with short-term crops, or to convert their rice land to aquaculture. It is worth noting that the rate of increase in aquaculture area in the Mekong Delta experienced an important surge after El Ninõ 2015–2016 (mean annual increase of 18.3 T ha in 2016–2019, as compared to 4.25 T ha in 2008–2015)."
8,"Increased flooding","Lowland Rice",EAP,"Impact","Seasonal river flooding, which coincides with the rainy season that runs from May to November, plays a critical role in the health of the Mekong river system. These floods deposit sediments, which improve soil fertility, flush out polluted waters, and recharge the groundwater tables. However, excessive flooding during the rainy season are becoming more frequent, and structural elements are not expected to hold up under an increasingly severe climate regime, which is driving sea-level rise (SLR) and changing meteorological and hydrological conditions. Chnages in climate are also causing flooding and drought in Lao PDR "
9,"Water scarcity","Lowland Rice",EAP,"Impact","The Mekong Delta is one of a number of localised agricultural regions in the world that face acute water risks, which we have identified as water-risk “hotspots” that require a targeted policy response. These water risks are not only the result of climate change but involve a range of factors, including farming itself, that cause water shortages, floods and degradation of water quality, extensive dam-building and ground water pumping."
10,"Reduced crop productivity/failure","Lowland Rice",EAP,"Impact","Climate change by 2050 will cause a significant reduction in rice yield, but the projections  depend on the rice crop season and the geographical area. Vast tracks of land planted with rice are affected by salinity intrusion and drought at the reproductive stage. Yields were reduced by 50-100%, or total loss. Shifting rainfall patterns  have an adverse effect on the agricultural productivity of the Mekong Delta.  Estimates of changes in crop productivity due to climate change are in the range of 2-30% over a 20-30 year period."
11,"Soil salinisation","Lowland Rice",EAP,"Impact",
12,"Siltation/sedimentation of rivers","Lowland Rice",EAP,"Impact",
13,"Change in production zone suitability","Lowland Rice",EAP,"Impact",
14,"Reduced water quality","Lowland Rice",EAP,"Impact",
15,"Elevation loss","Lowland Rice",EAP,"Impact",
16,"Land degradation","Lowland Rice",EAP,"Impact",
17,"Reduced produce quality","Lowland Rice",EAP,"Impact",
18,"Sediment starvation","Lowland Rice",EAP,"Impact",
19,"Coastal inundation","Lowland Rice",EAP,"Impact","A rise in the sea level of only 30 cm could see the loss of nearly 200,000 hectares of rice cultivation."
20,"Increase in food spoilage/wastage","Lowland Rice",EAP,"Impact","The emergence of severe droughts in the Mekong Delta has resulted in huge crop failures, with 90% of sowed fields perishing in the drought-impacted regions.This devastating drought damaged up to 30% of 29,900 ha rice in2019"
21,"Increase in food insecurity","Lowland Rice",EAP,"Impact","Frequent droughts and reduced crop productivity in various countries is increasing the threats of food insecurity."
22,"Dependence on food aid","Lowland Rice",EAP,"Impact","Vietnam recorded an extreme drought event in 2019 in 5 of 13 provinces in the Mekong Delta, and an emergency was declared. New Zealand Embassy announced humanitarian aid, totalling US$50,000, to communities in Ben Tre Province affected by drought and saltwater intrusion."
23,"Limited uptake of modern technologies","Lowland Rice",EAP,"Vulnerability","The capacity of agencies to provide accurate information for drought and salinity forecasting and early warning systems is limited. The distribution of updated information on salinity levels is slow. In Vietnam, it takes a long time until salinity measurements reach the farmers. Collected information has to first be elevated to and approved by high-level decision makers before it is distributed to the local level. Thus, farmers get outdated information on salinity. It would be beneficial if the process would be smoother and the information flow more direct without passing many entities."
24,"Unsustainable natural resource use","Lowland Rice",EAP,"Vulnerability","Sand mining is commonly practiced in along Mekong Delta"
25,"Unsustainable land management practices","Lowland Rice",EAP,"Vulnerability","On-farm deterioration in the quality of rice for sale, due to poor post-harvest management practices and inadequate storage conditions, is very significant in many areas and leads to reduced revenues from crop sales"
26,"Dependence on groundwater","Lowland Rice",EAP,"Vulnerability",
27,"Major component of local diet","Lowland Rice",EAP,"Vulnerability","Rice, the main staple of the Vietnamese diet, occupies 94% of arable land, is cultivated in all regions, and is the top crop in terms of planted area in 5 of the regions. Lowland rice farmin is also the main occupation for rural people in Savannakhet Province in Laos."
28,"Inconsistencies in policy implementation","Lowland Rice",EAP,"Vulnerability","Inconsistencies were observed in subsidy policies being implemented. During the winter spring season, farmers were recommended to reduce their planted areas to avoid losses. However, subsidies were only provided to farmers who had planted rice regardless of the warnings. The farmers who followed the recommendations did not receive any subsidy and/or support."
29,"Large contributor to national GDP","Lowland Rice",EAP,"Vulnerability","The Mekong River Delta (MRD) is the rice basket of Vietnam producing 56% of the total domestic rice production and accounting for 90% of Vietnam’s rice export. Over 1.7 million hectares of land, more than half of the total arable land in the region, are being used for rice production."
30,"Low access to markets","Lowland Rice",EAP,"Vulnerability"," Developing markets for by-products  such as rice straws could be one option to reduce vulnerability of the farmers to salinity intrusion. "
31,"Unfavourable soil conditions","Lowland Rice",EAP,"Vulnerability","Elicited by the El Niño, the drought has resulted in effects, such as reduced agricultural production, which limit the livelihoods and aggravates food insecurity in poor and vulnerable communities."
32,"Water scarce area","Lowland Rice",EAP,"Vulnerability","Elicited by the El Niño, the drought has resulted in effects, such as reduced agricultural production, which limit the livelihoods and aggravates food insecurity in poor and vulnerable communities."
33,"Fragmented landscapes","Lowland Rice",EAP,"Vulnerability","Increasing fragmentation of farmland has resulted from a growing agricultural population and the absence of primogeniture to maintain the integrity of holdings. In many instances farm sizes are now uneconomic, and even with the adoption of best practices would still only be marginal in terms of livelihood. If this trend is not reversed, an increasing proportion of farmers will be unable to rely on agriculture to ensure adequate food security and income levels. As a consequence, on-farm employment, and even complete exit from the system (e.g. permanent migration to urban areas), is likely to occur on a much larger scale."
34,"Lack of irrigation infrastructure ","Lowland Rice",EAP,"Vulnerability","Lack of irrigation water is affecting productivity in the lowland system. For instance, the low yield in Winter-Spring rice in Tra Vinh could be linked to the lack of irrigation water and saline intrusion during the dry season."
35,"Barrier to natural flows due to  infrastructure ","Lowland Rice",EAP,"Vulnerability","Hydropower dam construction forms barrier to flow of water and sediment. "
36,"Lack of access to improved crop varieties","Lowland Rice",EAP,"Vulnerability","Farmers’ knowledge and adoption of salinity- and drought-tolerant rice varieties is also limited, as these have seedling stage tolerance and are appropriate for the spring-summer cropping."
37,"Lack of access to improved crop varieties","Lowland Rice",EAP,"Vulnerability","In most countries, seed is generally of poor quality and not necessarily of the most recently recommended variety, because most farmers retain their own seed for replanting for many seed generations. While research services and private companies have developed new crop varieties - including hybrids - with higher yield potential and better local adaptability, they are often unavailable to the majority of farmers or are unsuited to their production practices. Production of seed of improved rice varieties is undertaken in many countries by government services, but quantities are generally much less than required by farmers. This situation has a serious adverse effect on crop yield and overall crop production."
38,"Inadequate climate information services","Lowland Rice",EAP,"Vulnerability",
39,"Poor efficiency of farming","Lowland Rice",EAP,"Vulnerability",
40,"Dependent on a single crop type","Lowland Rice",EAP,"Vulnerability",
41,"Small farm size","Lowland Rice",EAP,"Vulnerability"," Farm sizes are becoming uneconomic, and even with the adoption of best practices would still only be marginal in terms of livelihood. If the trend continues, an increasing proportion of farmers will be unable to rely on agriculture to ensure adequate food security and income levels."
42,"Invest in irrigation infrastructure","Lowland Rice",EAP,"Adaptation option","Promote appropriate water management practices during periods of high salinity (i.e. based on EC testing of irrigation water) in addition to use of salt tolerant, short maturing rice varieties. Manage upstream flow of the Mekong River. It is very important to maintain upstream flows in the future through upstream flow management."
43,"Structural adjustments","Lowland Rice",EAP,"Adaptation option","Resident are adjusting house conditions to cope with the floods. The adaptation measures include construction of storey buildings and elevation above ground level.  Construction of dykes to control the floods and saline water intrusion."
44,"Invest in water harvesting and storage infrastructure","Lowland Rice",EAP,"Adaptation option","Explore the method of underground taming of floods for irrigation (UTFI) proposed by IWMI (http://utfi.iwmi.org/) as an alternative for increasing the groundwater volume for irrigation in the dry season and reducing the damage by floods during heavy rains."
45,"Diversify livelihoods","Lowland Rice",EAP,"Adaptation option","Traditional rice-based farming systems in the region have always been diversified but cropping intensity was mostly low. Farmers have grown various food and non-food crops and raised livestock mainly to meet their domestic needs  Some of the practices in diversifying farming systems included livestock, horticulture, annual and perennial trees combined with livestock. These however depend on a stable supply of water for irrigation.  "
46,"Implement water conservation irrigation","Lowland Rice",EAP,"Adaptation option","Promote appropriate water management practices during periods of high salinity (i.e. based on EC testing of irrigation water) in addition to use of salt tolerant, short maturing rice varieties. Manage upstream flow of the Mekong River. It is very important to maintain upstream flows in the future through upstream flow management. Explore the method of underground taming of floods for irrigation (UTFI) proposed by IWMI (http://utfi.iwmi.org/) as an alternative for increasing the groundwater volume for irrigation in the dry season and reducing the damage by floods during heavy rains."
47,"Implement climate smart agriculture practices","Lowland Rice",EAP,"Adaptation option","Up-scale of CSA and CSV concepts to improve the resilience and adaptive capacities of local communities to extreme climate events. This should also be considered part of medium- and long-term measures. Improve/adopt sustainable resource management practices (water, soil, and crop management). In the three provinces visited, farmers extracted and over-used freshwater illegally, which can reduce freshwater availability for vulnerable communities in coastal areas. Trial, and if successful, out-scale insurance (e.g. weather-index based, remote sensing-based) programmes to protect smallholder farmers and agricultural businesses."
48,"Adopt drought tolerant varieties","Lowland Rice",EAP,"Adaptation option","Farmers’ knowledge and adoption of salinity- and drought-tolerant rice varieties is also limited, as these have seedling stage tolerance and are appropriate for the spring-summer cropping. Design a forward-looking breeding program for the development of new ‛designer’ varieties that fit the new cropping systems and carry the package of traits required for  climate resilience. These varieties should have optimum maturing periods (duration) based on available windows of opportunities and should also combine tolerance of current and foreseen abiotic stresses, such as salinity, drought and heat stress."
49,"Improve climate change awareness","Lowland Rice",EAP,"Adaptation option","Many local farmers do not follow warnings and instructions of local authorities based on rice cultivation calendars, climate and weather forecasts. This requires building mutual trust between farmers, local officers and researchers, providing consistent agro-advisories and supporting policies, and integrating local knowledge in response scenarios to seasonal weather forecasts."
50,"Adjust crop calendar","Lowland Rice",EAP,"Adaptation option","Determine the cut-off date for Dong Xuan season (i.e. the latest date of harvest of Dong Xuan) to avoid late season salinity. Vietnam has successfully implemented the cut-off date to avoid flooding/submergence in flood prone area, and a similar approach should be applied to saline areas."
51,"Invest in agricultural research and development","Lowland Rice",EAP,"Adaptation option","Integrated form of participatory research and extension should be developed and promoted, with less emphasis on single-crop research. This would benefit from synergies between productive activities, and would consider the whole-farm production system - including the sustainability of natural resources and the protection of the environment. Specific support should be given to the development of research resources, both equipment and human resources, to take advantage of new techniques in biotechnology and genetic engineering."
52,"Plant multiple varieties","Lowland Rice",EAP,"Adaptation option",
53,"Implement efficient water management","Lowland Rice",EAP,"Adaptation option","Implement water-saving technologies in upstream provinces (e.g. An Giang, Can Tho, Dong Thap) to reduce water withdrawal and allow for higher water flow to coastal provinces. This would reduce salinity intrusion in the region. "
54,"Build the capacity of agricultural extension agents","Lowland Rice",EAP,"Adaptation option","The capacity of  agencies to provide accurate information for drought and salinity forecasting and early warning systems is limited. This is aggravated by poor mechanisms for coordination, sharing of data and standardization of collected data among relevant ministries, line departments, local authorities, farmers and water users. For example, different teams from provincial departments are doing the  monitoring of water quality in the provinces, but data from these teams could not combined with salinity monitoring at commune levels because of problems in coordination and inconsistence in monitoring methods. "
55,"Improve access to climate information services","Lowland Rice",EAP,"Adaptation option","Existing national, regional and provincial salinity information systems are effective for managing irrigation infrastructure to access both saline and fresh water at the macro level. However information is insufficient to warn rice growers in time when water management infrastructure fails or is unable to protect their fields. If farmers measure and disseminate information about salinity variability in their immediate environment in cooperation with local authorities, communities can make collective decisions and put strategies in place to minimize the risks of salinity intrusion in their rice fields. A real-time salinity monitoring and advisory service in selected salinity-affected communities is needed."
56,"Develop/improve early warning systems","Lowland Rice",EAP,"Adaptation option","The development of an improved climate monitoring and early warning system should be prioritized to help mitigate negative impacts induced by climate change in the Mekong Delta. These can also be used to disseminate technical advisories for drought and salinity preparedness, and recommended adaptation measures (e.g. cut-off dates for rice transplanting/sowing or rearing shrimp, suitable drought and saline tolerant varieties, appropriate farming techniques and practices)."
57,"Build capacity on usage of climate information","Lowland Rice",EAP,"Adaptation option","The capacity of agencies to provide accurate information for drought and salinity forecasting and early warning systems is limited. This is aggravated by poor mechanisms for coordination, sharing of data and standardization of collected data among relevant ministries, line departments, local authorities, farmers and water users. For example, different teams from provincial departments are doing the roving monitoring of water quality in the provinces, but data from these teams could not combined with salinity monitoring at commune levels because of problems in coordination and inconsistence in monitoring methods. "
58,"Improve interprovincial interventions","Lowland Rice",EAP,"Adaptation option","In the MRD, agriculture production of adjacent provinces is interlinked to each other through their land use decisions, water sharing scheme, and farming practice. For example, water holding strategy of upstream provinces may lead to water shortages in downstream regions, or improper shrimp farming techniques of coastal regions may result in intrusion of saline water in rice lands."
59,"Develop policies for building climate change resilience","Lowland Rice",EAP,"Adaptation option"," For sustainable rice production in the system, changing cropping calendar and system cannot be done alone but have to be implemented together with structural measures, water saving technologies, tolerant varieties, and policy and institution. "
60,"Improve access to input/output markets","Lowland Rice",EAP,"Adaptation option","Maintaining rice production under the increasing impact of climate change, reducing input costs through large scale mechanization and irrigation management and ensuring the stable market price are the major priorities of the farmers, managers and policy makers."
61,"Farmers engaged in agri system","Lowland Rice",EAP,"Exposure","The MRD covers an area of about 39,000 km. With a total population of 17.5 million people (about 19% of the national population). The total area of agricultural land in the MRD is 2.6 million hectares. With this land resource, the region produces about 50% of the total amount of food in Vietnam and ensures food security and livelihoods for approximately 70% of the region’s population."
62,"Area of land used","Lowland Rice",EAP,"Exposure","The MRD covers an area of about 39,000 km. With a total population of 17.5 million people (about 19% of the national population). The total area of agricultural land in the MRD is 2.6 million hectares. With this land resource, the region produces about 50% of the total amount of food in Vietnam and ensures food security and livelihoods for approximately 70% of the region’s population."
63,"Food insecurity","Lowland Rice",EAP,"Risk","The rice production system that has a significant role in food security of the country, is increasingly under pressure from climatic related impacts. The Mekong River Delta contributes more than a half of the total domestic rice production and more than 90% of Vietnam’s rice export annually."
64,"Loss of livelihoods ","Lowland Rice",EAP,"Risk"," Coastal induction and saline intrusion are increasing the putting the framers at risks of losing harvests thus impacting on their livelihood"
65,"Chronic poverty ","Lowland Rice",EAP,"Risk","Average household incomes are low and poverty is extensive and severe in many areas.The drought and saltwater intrusion has made hundreds of thousands of families more serious, while most of them are already living under poverty line."
66,"Increase in frost events","Temperate Mixed",EAP,"Hazard","Northern Subsystem is characterized by severe frosts in winter."
67,"Shorter growing season","Temperate Mixed",EAP,"Hazard",
68,"Increase in extreme rainfall events","Temperate Mixed",EAP,"Hazard","Both the Loess Plateau and the Northern Sub-System are characterised by rainfall being concentrated in the summer months."
69,"Increase in hailstorms","Temperate Mixed",EAP,"Hazard","Most storms form in the summer between June and November and the islands of the Philippines are generally the hardest hit."
70,"Increase in tropical cyclones/hurricanes","Temperate Mixed",EAP,"Hazard","The region actually has more tropical cyclone activity than anywhere else on Earth."
71,"Rising sea levels","Temperate Mixed",EAP,"Hazard","The region including contries with this agri system experience sea level rise."
72,"Increase in drought events","Temperate Mixed",EAP,"Hazard","Most parts of East Asia including those with temperate mixed systems are regularly hit by droughts. Though starting slowly, droughts can have devastating cumulative impacts – striking hardest at the poor and heightening inequality, as well as degrading land and reduced crop production.Following the 2015–2016 El Niño-induced drought, the total rice production fell to 27 million tonnes, the lowest since 2000."
73,"Increase in strong winds","Temperate Mixed",EAP,"Hazard","Most parts of the region experiences an important climatic phenomenon  called monsoon which is generated by a reversal of winds."
