ID,"Label","FS name",FS macro region,"Type-1","Description"
1173,"Reduced forage quality","Agro-Pastoral Millet/Sorghum",SSA,"Impact","Projections into the future generally indicate widespread negative impacts on forage quality"
1174,"Change in production zone suitability","Agro-Pastoral Millet/Sorghum",SSA,"Impact","As a result of climate change agropastoral-pastoral margin will retreat across Africa resulting in less area climatically suited for productive agropastoral practices."
1175,"Water scarcity","Agro-Pastoral Millet/Sorghum",SSA,"Impact","Increased temperatures causing reduce water and pasture avilability  hence causing reduction in livestock health and competition for resources and conflicts"
1176,"Increased incidence of bushfires","Agro-Pastoral Millet/Sorghum",SSA,"Impact"," Bush fire incidences occurs in pastoral systems often during. Extreme drought events are likely to worsen such practices"
1177,"Increase in pests ","Agro-Pastoral Millet/Sorghum",SSA,"Impact","Amplified effects of parasites due to lowered immunity associated with poor nutrition."
1178,"Crop stress/damage/mortality","Agro-Pastoral Millet/Sorghum",SSA,"Impact",
1179,"Unpredictable planting period","Agro-Pastoral Millet/Sorghum",SSA,"Impact",
1180,"Reduced livestock productivity","Agro-Pastoral Millet/Sorghum",SSA,"Impact",
1181,"Reduced fodder quality","Agro-Pastoral Millet/Sorghum",SSA,"Impact",
1182,"Increase in heat stress","Agro-Pastoral Millet/Sorghum",SSA,"Impact",
1183,"Land degradation","Agro-Pastoral Millet/Sorghum",SSA,"Impact",
1184,"Decrease in diseases","Agro-Pastoral Millet/Sorghum",SSA,"Impact","Decrease in vectoral diseases e.g. tsetse fly. "
1185,"Increase in livestock mobility","Agro-Pastoral Millet/Sorghum",SSA,"Impact","Increase in livestock mobility in search for water and forage."
1186,"Competition for resources","Agro-Pastoral Millet/Sorghum",SSA,"Impact","Competition with non-nomadic farmers for access to water."
1187,"Increase in migration","Agro-Pastoral Millet/Sorghum",SSA,"Impact",
1188,"Conflict over resources","Agro-Pastoral Millet/Sorghum",SSA,"Impact",
1189,"Decrease in livestock mobility","Agro-Pastoral Millet/Sorghum",SSA,"Impact",
1190,"Dependence on food aid","Agro-Pastoral Millet/Sorghum",SSA,"Impact",
1191,"Loss of income","Agro-Pastoral Millet/Sorghum",SSA,"Impact",
1192,"Increase in food insecurity","Agro-Pastoral Millet/Sorghum",SSA,"Impact",
1193,"Increase in poverty","Agro-Pastoral Millet/Sorghum",SSA,"Impact","Close to 100 million farmers, half of them extremely poor, live in the African agropastoral farming system characterized by highly variable, semi-arid climate and poor soil conditions"
1194,"Unsustainable natural resource use","Agro-Pastoral Millet/Sorghum",SSA,"Vulnerability","Unsustainable land and water management practices in the system  which contributes to land degradation,reduced productivity"
1195,"Demographic pressure on land","Agro-Pastoral Millet/Sorghum",SSA,"Vulnerability","Key trends in the system include rapid population growth and urbanization"
1196,"Reliance on rainfed agriculture","Agro-Pastoral Millet/Sorghum",SSA,"Vulnerability",
1197,"High illiteracy rates ","Agro-Pastoral Millet/Sorghum",SSA,"Vulnerability",
1198,"Unequal opportunities for women ","Agro-Pastoral Millet/Sorghum",SSA,"Vulnerability","A major gender gap in the agropastoral system concerns customary access to land, the most basic production factor."
1199,"Weak land tenure and access rights for women","Agro-Pastoral Millet/Sorghum",SSA,"Vulnerability",
1200,"Weak land tenure ","Agro-Pastoral Millet/Sorghum",SSA,"Vulnerability",
1201,"Inadequate climate information services","Agro-Pastoral Millet/Sorghum",SSA,"Vulnerability","Information on weather predictions and early warning mechanisms is often inadequate  and untimely"
1202,"Low access to markets","Agro-Pastoral Millet/Sorghum",SSA,"Vulnerability","Both domestic and international market systems are underdeveloped in most systems. In East Africa pastoralists travel Long distance from the urban centres"
1203,"Barriers to trade","Agro-Pastoral Millet/Sorghum",SSA,"Vulnerability",
1204,"Lack of access to market information","Agro-Pastoral Millet/Sorghum",SSA,"Vulnerability","To reduce financial risks and purchase of inputs such as fertiliser, slash and burn is used to control weeds and a limited form of shifting cultivation are only practised in low population areas, for example Mozambique and Zambia, and also in southern Ethiopia, as justified by bush encroachment in bimodal and subtropical bioclimates"
1205,"Low access to credit","Agro-Pastoral Millet/Sorghum",SSA,"Vulnerability",
1206,"Unstable commodity prices","Agro-Pastoral Millet/Sorghum",SSA,"Vulnerability",
1207,"Water scarce area","Agro-Pastoral Millet/Sorghum",SSA,"Vulnerability","Reduced water availability since 1960, especially around the Senegal River Basin."
1208,"High prevalence of land degradation","Agro-Pastoral Millet/Sorghum",SSA,"Vulnerability","Land degradation affects 34% of the territory. Soil degradation is prominent, it is primarily caused by overgrazing and forest clearing."
1209,"Unfavourable soil conditions","Agro-Pastoral Millet/Sorghum",SSA,"Vulnerability","The system is characterized by highly variable, semi-arid climate and poor soil conditions."
1210,"Land fragmentation","Agro-Pastoral Millet/Sorghum",SSA,"Vulnerability","The increasing subdivision and privatization of land in East Africa particularly Kenya complicates livelihoods as it may lead to fencing, which reduces livestock access to pasture, watering points and saltlicks, and curtails mobility during drought.  In west Africa, there is increasing restriction to mobility due to expansion of crop field into grazing land. Some pastoralists go on long distance transhumance to sub-humid zone "
1211,"Small farm size","Agro-Pastoral Millet/Sorghum",SSA,"Vulnerability","Farm sizes are usually small and diversity is the norm in West African farming systems. Even at the level of the individual farm unit, farmers typically cultivate 10 or more crops in diverse mixtures that vary across soil type, topographical position and distance from the household compound."
1212,"Limited uptake of modern technologies","Agro-Pastoral Millet/Sorghum",SSA,"Vulnerability","Low adoption of new technology is mostly related to their low profitability and perceived risks rather than available capital"
1213,"High poverty levels ","Agro-Pastoral Millet/Sorghum",SSA,"Vulnerability","Close to 100 million farmers, half of them extremely poor, live in the African agropastoral farming syste.  Senegal for example is has 47% of the population living under the national poverty line."
1214,"Unequal opportunities for women ","Agro-Pastoral Millet/Sorghum",SSA,"Vulnerability","Gender inequality  is high in the system due to traditional social and religious norms."
1215,"Limited uptake of modern technologies","Agro-Pastoral Millet/Sorghum",SSA,"Vulnerability","Smallholder farmers lack the capacity to process, store or distribute agricultural products."
1216,"Lack of knowledge on processing/value addition","Agro-Pastoral Millet/Sorghum",SSA,"Vulnerability","Smallholder farmers lack the capacity to process, store or distribute agricultural products.Technology will play a significant role in adapting pastoral and agro-pastoral systems to climate change"
1217,"Predominantly small-scale subsistence farming","Agro-Pastoral Millet/Sorghum",SSA,"Vulnerability","More than 90% of Senegal's agricultural land is comprised of small-scale, family-based farms engaged in subsistence and rain-fed agriculture."
1218,"Conflict prone area","Agro-Pastoral Millet/Sorghum",SSA,"Vulnerability","Tradition of violent theft of cattle (cattle rustling) and problem of armed rebellion in the Horn of Africa. Ther is also conflict occassionally along transhumance routes West Africa. In some other parts agro-pastoralist land is being lost to agricultural investors and this is likely to hinder mobility. This is likely to affect traditional migratory routes  for different seasons"
1219,"Unequal opportunities for women ","Agro-Pastoral Millet/Sorghum",SSA,"Vulnerability","One of the challenges for the system is land resource access and tenure constraints especially for women.  Customary tenure systems continue to predominate in the system, especially in rural areas, in spite of statutoryefforts to ‘modernize’ the tenure landscape in recent decades."
1220,"Lack of willingness to invest in sustainable agricultural practices","Agro-Pastoral Millet/Sorghum",SSA,"Vulnerability",
1221,"Reliance on rainfed agriculture","Agro-Pastoral Millet/Sorghum",SSA,"Vulnerability",
1222,"Large contributor to national GDP","Agro-Pastoral Millet/Sorghum",SSA,"Vulnerability",
1223,"Reliance on rainfed agriculture","Agro-Pastoral Millet/Sorghum",SSA,"Vulnerability",
1224,"Dependent on a single crop type","Agro-Pastoral Millet/Sorghum",SSA,"Vulnerability",
1225,"Demographic pressure on land","Agro-Pastoral Millet/Sorghum",SSA,"Vulnerability","Demographic pressure on land is transforming transhumance and communal grazing to more sedentary forms of production."
1226,"Implement reforestation practices","Agro-Pastoral Millet/Sorghum",SSA,"Adaptation option"," Scale-up agroforestry interventions e.g. farmer-managed natural regeneration (FMNR)."
1227,"Invest in water harvesting and storage infrastructure","Agro-Pastoral Millet/Sorghum",SSA,"Adaptation option","Construction of small dams in Senegal to collect water for farming and animal use "
1228,"Diversify livelihoods","Agro-Pastoral Millet/Sorghum",SSA,"Adaptation option","Farmers adapt to uncertain climatic and environmental conditions through a range of adaptive management practices such as adoption of short cycle cultivars, the relocation of some crops and the practice of market gardening in rainy conditions alternating according to the seasons and women breeding small ruminants for sale."
1229,"Promote literacy ","Agro-Pastoral Millet/Sorghum",SSA,"Adaptation option","An increase in education amongst pastoralist communities, resulting in increasing opportunities for new employment and diversification, and participation in national political processes "
1230,"Build women's  capacity ","Agro-Pastoral Millet/Sorghum",SSA,"Adaptation option","Increase women access to land resources and paid labour to enhance their benefits and enable them to access opportunities for value addition and improved production"
1231,"Implement fodder management","Agro-Pastoral Millet/Sorghum",SSA,"Adaptation option","Promote market-driven models to establish fodder production via such as purely rain-fed fodder production,rain-fed fodder with supplemental irrigation from harvested rainwater (e.g., sub-surface dams) andf odder production based on the groundwater irrigation for sites with groundwater table close to the surface."
1232,"Implement efficient water management","Agro-Pastoral Millet/Sorghum",SSA,"Adaptation option","In southern Africa some of the strategies include reducing the plant population to reduce the water demand by crops."
1233,"Diversify livestock ","Agro-Pastoral Millet/Sorghum",SSA,"Adaptation option","Shift to small ruminants and camels. "
1234,"Implement fodder management","Agro-Pastoral Millet/Sorghum",SSA,"Adaptation option",
1235,"Adopt drought tolerant varieties","Agro-Pastoral Millet/Sorghum",SSA,"Adaptation option","Adaptation strategies such as switching to improved varieties in climate change-sensitive crops need to be considered, yet should be carefully weighed against adverse outcomes, such as a resulting decline of agro-biodiversity and loss of local crop types"
1236,"Plant multiple varieties","Agro-Pastoral Millet/Sorghum",SSA,"Adaptation option","Cultivar devopment targeting varieties that response to more than one threats "
1237,"Implement efficient water management","Agro-Pastoral Millet/Sorghum",SSA,"Adaptation option","Implement water conservation technologies alongside cultivar development e.g irrigation and water harvesting, sub, surface dams along river beds"
1238,"Implement agroforestry practices","Agro-Pastoral Millet/Sorghum",SSA,"Adaptation option","Integrating trees with crops serve as “nutrient pumps,” bringing nutrients that are too deep for crops. They can be used to enhance soil nitrogen, when nitrogen-fixing trees are planted. Their leaves can serve as mulch which might suppress some weed growth but would also help cool the soil."
1239,"Improve climate change awareness","Agro-Pastoral Millet/Sorghum",SSA,"Adaptation option","With climate information services, farmers will be able to plan their planting and make projections about rainfall distribution patterns and temperature variations"
1240,"Implement conservation agriculture practices","Agro-Pastoral Millet/Sorghum",SSA,"Adaptation option","Soil organic matter is beneficial to cultivation, due to its abilities to improve soil structure and enhance water and nutrient retention. It includes practices such as no-till agriculture, offseason cover crops, use of animal manure and biochar."
1241,"Adjust crop calendar","Agro-Pastoral Millet/Sorghum",SSA,"Adaptation option",
1242,"Livestock mobility to semi-arid/sub-humid zones","Agro-Pastoral Millet/Sorghum",SSA,"Adaptation option",
1243,"Plant multiple crop types","Agro-Pastoral Millet/Sorghum",SSA,"Adaptation option",
1244,"Plant multiple crop types","Agro-Pastoral Millet/Sorghum",SSA,"Adaptation option",
1245,"Capacity building on sustainable agricultural practices","Agro-Pastoral Millet/Sorghum",SSA,"Adaptation option",
1246,"Build capacity on value addition","Agro-Pastoral Millet/Sorghum",SSA,"Adaptation option",
1247,"Undertake crop rotation","Agro-Pastoral Millet/Sorghum",SSA,"Adaptation option","Limited form of shifting cultivation are only practised in low population areas, for example Mozambique and Zambia, and also in southern Ethiopia, as justified by bush encroachment in bimodal and subtropical bioclimates"
1248,"Establish farmer organisations","Agro-Pastoral Millet/Sorghum",SSA,"Adaptation option","A significant potential for poverty reduction is expected through the intensification and diversification of the agropastoral system, especially among farmers who are able to organize themselves in farmer associations."
1249,"Increase awareness of gender equality ","Agro-Pastoral Millet/Sorghum",SSA,"Adaptation option",
1250,"Build the capacity of agricultural extension agents","Agro-Pastoral Millet/Sorghum",SSA,"Adaptation option","Build capacity and support technical and extension services and research."
1251,"Invest in agricultural research and development","Agro-Pastoral Millet/Sorghum",SSA,"Adaptation option",
1252,"Invest in agricultural research and development","Agro-Pastoral Millet/Sorghum",SSA,"Adaptation option","Incorporating in R&D approaches to build a whole system capacity and adopting an integrated approach that addresses the range of constraints farmers face along the value chain."
1253,"Land tenure reform","Agro-Pastoral Millet/Sorghum",SSA,"Adaptation option","Improve land tenure and access rights in the agropastoral system."
1254,"Improve access to climate information services","Agro-Pastoral Millet/Sorghum",SSA,"Adaptation option","Increased access to agricultural support services, which improves the availability and the quality of relevant climate information will further enhance awareness of climate change within of the rural community and result in better management of climate-induced risks in these vulnerable agricultural systems.asts and early warning systems."
1255,"Improve access to agricultural extension services","Agro-Pastoral Millet/Sorghum",SSA,"Adaptation option",
1256,"Policy reform","Agro-Pastoral Millet/Sorghum",SSA,"Adaptation option",
1257,"Develop/improve early warning systems","Agro-Pastoral Millet/Sorghum",SSA,"Adaptation option","Use of intricate systems of local knowledge to predict weather or forecast a climatic event. This allows pastoralists to better plan for and manage drought (for example, agro-pastoralists in Kenya use indigenous indicators of rainfall variability to interpret meteorological forecasts)"
1258,"Build climate information services","Agro-Pastoral Millet/Sorghum",SSA,"Adaptation option",
1259,"Improve access to markets","Agro-Pastoral Millet/Sorghum",SSA,"Adaptation option","Improved access to markets for tree products, cereals and animal feeds has increased commercialisation of the products and competition for resources.I Market access also enhance diversified production and community resilience."
1260,"Improve access to credit","Agro-Pastoral Millet/Sorghum",SSA,"Adaptation option","The conversion of livestock resources into financial resources through uptake of saving schemes which can smooth livelihood volatility. Credit schemes may help with investment that can increase productivity or livelihood diversification"
1261,"Facilitate access to loans","Agro-Pastoral Millet/Sorghum",SSA,"Adaptation option","Sharing, loaning and gifting of livestock is part of pastoralists’ traditional social networks, but intensifies during and after drought. Also sharing of labour between families to act as a social safety-net"
1262,"Improve access to market information","Agro-Pastoral Millet/Sorghum",SSA,"Adaptation option","Develop market information systems."
1263,"Improve access to risk insurance schemes","Agro-Pastoral Millet/Sorghum",SSA,"Adaptation option",
1264,"Farmers engaged in agri system","Agro-Pastoral Millet/Sorghum",SSA,"Exposure","More than 90% of Senegal's agricultural land is comprised of small-scale, family-based farms engaged in subsistence and rain-fed agriculture. The livestock sub-sector employs about 3 million people."
1265,"Area of land used","Agro-Pastoral Millet/Sorghum",SSA,"Exposure","Permanent meadows and pastures for livestock rearing constitute 29% of Senegal's total harvested land area."
1266,"Risk to farmers of loss of livelihoods due to Climate Change","Agro-Pastoral Millet/Sorghum",SSA,"Risk","Climate change affecting the ability to sustain agro-pastoralist livelihoods in East africa region"
1267,"Risk to farmers of food insecurity due to Climate Change","Agro-Pastoral Millet/Sorghum",SSA,"Risk","Chronic food insecurity contributed by rainfall variability and poor soils"
1268,"Risk to farmers of chronic poverty due to Climate Change","Agro-Pastoral Millet/Sorghum",SSA,"Risk",
1269,"Increase in drought events","Cereal-Root Crop Mixed",SSA,"Hazard","Devastating droughts have occurred in the past in the dry sub-humid parts of the zone, such as in 1930, 1972 and more recently in the farming system."
1270,"Increasingly erratic rainfall","Cereal-Root Crop Mixed",SSA,"Hazard","There is considerable excess of rainfall over evapotranspiration."
1271,"Increase in average temperatures","Cereal-Root Crop Mixed",SSA,"Hazard","It also has higher temperatures and in some areas the presence of a tsetse challenge which limits livestock numbers and prevents the use of animal traction, particularly in the moist sub-humid zone."
1272,"Increase in extreme rainfall events","Cereal-Root Crop Mixed",SSA,"Hazard"," The frequency of extreme weather events such as rainfalls has increased substantially in the region over the past four decades, and it has increased at a faster pace than in the rest of the world."
1273,"Rising sea levels","Cereal-Root Crop Mixed",SSA,"Hazard","There is significant regional variability in sea-level trends around Africa. Sea-level increase reached 5 mm per year in several oceanic areas surrounding the continent and exceeded 5 mm per year in the south-western Indian Ocean from Madagascar eastward towards and beyond Mauritius."
1274,"Increase in tropical cyclones/hurricanes","Cereal-Root Crop Mixed",SSA,"Hazard","Tropical Cyclone Idai was among the most destructive tropical cyclones ever recorded in the southern hemisphere, resulting in hundreds of casualties and hundreds of thousands of displaced."
1275,"Soil erosion","Cereal-Root Crop Mixed",SSA,"Impact","The farming system experiences deleterious levels of soil erosion, largely due to the interaction between harsh climates of high erosivity, fragile soils of high erodibility, steep slopes, and poor natural resource management."
1276,"Landslide events","Cereal-Root Crop Mixed",SSA,"Impact","Landslide events occur due to increased rainfall that's poorly distributed.Landslides (LS) impacts are acute in regions whichare characterized by mountainous topography, intense rains and deep weathering profiles."
1277,"Shift in growing season","Cereal-Root Crop Mixed",SSA,"Impact","Growing seasons have been pushed forward due to delays in rainfall around planting time and increased drought events."
1278,"Flash floods","Cereal-Root Crop Mixed",SSA,"Impact","Heavy rainfall that's poorly distributed causes flash floods in some regions."
1279,"Damage to infrastructure","Cereal-Root Crop Mixed",SSA,"Impact","One of sub-Saharan Africa's top developmental challenges, which is also affecting the farming system, continues to be the shortage of physical infrastructure. For instance,electricity infrastructure is largely inadequate, unreliable, and poorly developed, particularly in rural areas."
1280,"Leaching of soil nutrients","Cereal-Root Crop Mixed",SSA,"Impact","Irregular heavy rainfall patterns result in fertiliser and nutrient leaching."
1281,"Siltation/sedimentation of rivers","Cereal-Root Crop Mixed",SSA,"Impact","Heavy rainfall causes soil erosion which leads to sedimentation of rivers."
1282,"Reduced crop productivity/failure","Cereal-Root Crop Mixed",SSA,"Impact","Crop yields in the farming system have lagged behind due pest and disease attack, and also declining soil fertility."
1283,"Increase in diseases","Cereal-Root Crop Mixed",SSA,"Impact","Cassava Mosaic and Brown Streak virus diseases continue to affect the main food crop, cassava, in Sub -Saharan Africa."
1284,"Land degradation","Cereal-Root Crop Mixed",SSA,"Impact","About 65% of the agricultural land is degraded, mainly due to low nutrient application, soil erosion and soil acidification."
1285,"Delays in transportation","Cereal-Root Crop Mixed",SSA,"Impact","Delays in transportation in the region due to poor infrastructure."
1286,"Loss of income","Cereal-Root Crop Mixed",SSA,"Impact","Loss of income due to declining crop yield caused by changes in rainfall patterns together with increase in temperatures."
1287,"Increase in food insecurity","Cereal-Root Crop Mixed",SSA,"Impact","Food insecurity and hunger are caused by many factors, often being intertwined with one another. In general, the principal causes of hunger include poverty, conflict, climate and weather, lack of investment in agriculture, and unstable markets."
1288,"Increase in poverty","Cereal-Root Crop Mixed",SSA,"Impact","Majority of the population in the system are living in abject poverty."
1289,"Increase in food prices","Cereal-Root Crop Mixed",SSA,"Impact","Food inflation increased throughout 2019, on average, across 20 countries in the region due to  supply and demand, weather, disease outbreaks, war, and natural disasters."
1290,"Increase in food spoilage/wastage","Cereal-Root Crop Mixed",SSA,"Impact","Nearly a third of the food farmers grow in the farming system  is lost due to lack of refrigeration and poor market access. "
1291,"Increase in malnutrition/ Reduced calorie intake","Cereal-Root Crop Mixed",SSA,"Impact","A significant proportion of the population in the farming system is undernourished and experiences food shortages during the hungry period , that is at the end of the dry season and beginning of the wet season."
1292,"Conflict over resources","Cereal-Root Crop Mixed",SSA,"Impact","Cattle herders and crop cultivators in the farming system have been fighting over natural resources."
1293,"Reliance on rainfed agriculture","Cereal-Root Crop Mixed",SSA,"Vulnerability","Farming system is vulnerable to the impacts of global climate change. This is largely due to the region's reliance on rainfed agriculture, which is highly sensitive to changes in temperature, precipitation, and extreme weather events."
1294,"Limited uptake of modern technologies","Cereal-Root Crop Mixed",SSA,"Vulnerability","Mechanization technology for the needs of smallholders in this system is sorely needed."
1295,"Crop is highly susceptible to diseases ","Cereal-Root Crop Mixed",SSA,"Vulnerability","The system is vulnerable to Invasive species i.e maize striga and cassava mosaic which are a major cause of crop loss and can adversely affect food security in the region."
1296,"High poverty levels ","Cereal-Root Crop Mixed",SSA,"Vulnerability","About half the population in this farming system lives in abject poverty"
1297,"Low levels of climate change awareness at the farmer level","Cereal-Root Crop Mixed",SSA,"Vulnerability","Africa is probably the most vulnerable continent to climate change and variability, because of the combination of its low adaptive capacity with particular eco-climatic and socio-economic conditions. Nevertheless it remains one of the regions less covered by climate change studies"
1298,"Unsustainable natural resource use","Cereal-Root Crop Mixed",SSA,"Vulnerability","Revenues from the extraction of natural resources should provide funds for badly needed development, but instead have fuelled state corruption, environmental degradation, poverty and violence in the region."
1299,"Weak land tenure and access rights for women","Cereal-Root Crop Mixed",SSA,"Vulnerability","Women represent a large part of the 2.5 billion people who depend on lands managed through customary, community-based tenure systems and are especially reliant on commons for their lives and livelihoods. However,they have very often limited and unsecured access to land and natural resources and tend to be excluded from decisions concerning them."
